{
  "event_id": "135a6281-d61a-5991-8305-309a3959d4b9",
  "event_type": "alert.created",
  "schema_version": 1,
  "occurred_at": "2026-09-17T08:15:30Z",
  "institution_id": "5b1e8f4a-2c3d-4e5f-8a9b-0c1d2e3f4a5b",
  "producer": "fraudshield-api",
  "traceparent": "00-4bf92f3577b34da6a3ce929d0e0e4736-00f067aa0ba902b7-01",
  "payload": {
    "alert_id": "2b3c4d5e-6f7a-4b8c-9d0e-1f2a3b4c5d6e",
    "version": 0,
    "transaction_id": "c1d2e3f4-a5b6-4c7d-8e9f-0a1b2c3d4e5f",
    "account_token": "tok_exampleAgentCustomer00001",
    "tier": "ANOMALY",
    "fraud_probability": 0.31,
    "anomaly_score": 0.998,
    "amount": {
      "amount": "250000",
      "currency": "UGX"
    },
    "channel": "AGENT_BANKING",
    "transaction_timestamp": "2026-09-17T17:45:00Z",
    "scoring_result_id": "3c4d5e6f-7a8b-4c9d-8e0f-1a2b3c4d5e6f",
    "review_deadline_at": null,
    "holds_transaction": false
  }
}
