{
  "event_id": "0d1e2f3a-4b5c-4d6e-8f70-81a2b3c4d5e6",
  "event_type": "notification.requested",
  "schema_version": 1,
  "occurred_at": "2026-09-17T08:15:30Z",
  "institution_id": "5b1e8f4a-2c3d-4e5f-8a9b-0c1d2e3f4a5b",
  "producer": "fraudshield-api",
  "traceparent": "00-4bf92f3577b34da6a3ce929d0e0e4736-00f067aa0ba902b7-01",
  "payload": {
    "notification_id": "4d5e6f7a-8b9c-4d0e-9f1a-2b3c4d5e6f7a",
    "account_token": "tok_A1b2C3d4E5f6G7h8J9k0L1m2",
    "channel": "SMS",
    "template_key": "sms.auto_block",
    "locale": "rw",
    "auto_block_event_id": "5e6f7a8b-9c0d-4e1f-8a2b-3c4d5e6f7a8b",
    "verification_link_allowed": false,
    "parameters": {
      "masked_account": "****4821",
      "amount": {
        "amount": "15000",
        "currency": "RWF"
      },
      "local_time": "10:15 CAT",
      "reference_code": "FS7K2Q9P"
    }
  }
}
