{
  "event_id": "0adb7454-164f-57d0-87b5-df3ed01db790",
  "event_type": "label.recorded",
  "schema_version": 1,
  "occurred_at": "2026-09-17T08:15:30Z",
  "institution_id": "5b1e8f4a-2c3d-4e5f-8a9b-0c1d2e3f4a5b",
  "producer": "fraudshield-api",
  "traceparent": "00-4bf92f3577b34da6a3ce929d0e0e4736-00f067aa0ba902b7-01",
  "payload": {
    "label_id": "7a8b9c0d-1e2f-4a3b-8c4d-5e6f7a8b9c0d",
    "transaction_id": "3f8e0c5a-6b1d-4f5e-9a2b-7c4d1e8f0a11",
    "label": "FRAUD",
    "source": "ANALYST",
    "fraud_type": "SIM_SWAP",
    "label_available_at": "2026-09-17T08:20:02Z",
    "transaction_timestamp": "2026-09-17T08:15:30Z",
    "supersedes_label_id": null
  }
}
