{
  "event_id": "0d1e2f3a-4b5c-4d6e-8f70-81a2b3c4d5e6",
  "event_type": "alert.created",
  "schema_version": 1,
  "occurred_at": "2026-09-17T08:15:30Z",
  "institution_id": "5b1e8f4a-2c3d-4e5f-8a9b-0c1d2e3f4a5b",
  "producer": "fraudshield-api",
  "traceparent": "00-4bf92f3577b34da6a3ce929d0e0e4736-00f067aa0ba902b7-01",
  "payload": {
    "alert_id": "1a2b3c4d-5e6f-4a7b-8c9d-0e1f2a3b4c5d",
    "version": 0,
    "transaction_id": "7a2c9e41-0d3b-4c8a-b5f6-1e2d3c4b5a60",
    "account_token": "tok_U5sdF3atur3Ph0n3Acct0001",
    "tier": "MEDIUM",
    "fraud_probability": 0.71,
    "amount": {
      "amount": "5000",
      "currency": "RWF"
    },
    "channel": "USSD",
    "transaction_timestamp": "2026-09-17T06:02:11Z",
    "scoring_result_id": "8b7a6c5d-4e3f-4a2b-9c1d-0e9f8a7b6c5d",
    "review_deadline_at": "2026-09-17T06:02:41Z",
    "holds_transaction": true
  }
}
