{
  "event_id": "44116889-d280-52b9-b431-8477c1ff45d0",
  "event_type": "alert.created",
  "schema_version": 1,
  "occurred_at": "2026-09-17T08:15:30Z",
  "institution_id": "5b1e8f4a-2c3d-4e5f-8a9b-0c1d2e3f4a5b",
  "producer": "fraudshield-api",
  "traceparent": "00-4bf92f3577b34da6a3ce929d0e0e4736-00f067aa0ba902b7-01",
  "payload": {
    "alert_id": "9c8b7a6d-5e4f-4a3b-8c2d-1e0f9a8b7c6d",
    "version": 0,
    "transaction_id": "3f8e0c5a-6b1d-4f5e-9a2b-7c4d1e8f0a11",
    "account_token": "tok_exampleAccount0000000001",
    "tier": "HIGH",
    "fraud_probability": 0.91,
    "anomaly_score": 0.62,
    "amount": {
      "amount": "15000",
      "currency": "RWF"
    },
    "expected_loss_rwf": "13650",
    "channel": "MOBILE_MONEY",
    "transaction_timestamp": "2026-09-17T08:15:30Z",
    "scoring_result_id": "2a3b4c5d-6e7f-4a8b-9c0d-1e2f3a4b5c6d",
    "review_deadline_at": null,
    "holds_transaction": false,
    "reason_codes": [
      "VELOCITY_SPIKE"
    ]
  }
}
